id,name,contactType,favoriteEmail,description,emails,favoriteUrl,urls,favoritePhone,phones,favoriteAddress,addresses,groups,Founded Date,Investment Stage,Investor Type,Number of Exits,Number of Investments,Operating Status
22eb926b-1f35-402b-8b73-554227df3c05,Oltre Impact,company,,Impact Investing,,linkedin.com/company/oltre-impact/,linkedin.com/company/oltre-impact/,,,"Milano, Lombardia, Italy","Milano, Lombardia, Italy",VC Founds - Seed - US/Europe,Jan-2006,,Venture Capital,1,5,Active
4135c4af-ecd7-4375-85da-89e536dd931a,One Way Ventures,company,,"Finance, Financial Services, Venture Capital",,https://onewayvc.com/,https://onewayvc.com/,,,"Boston, MA, USA","Boston, MA, USA","All VCs ,VC Founds - Seed - US/Europe",Nov-2017,"Convertible Note, Early Stage Venture, Seed",Venture Capital,8,92,Active
db8d16d6-a399-4fcf-abf3-bd31107a6081,OpenView,company,,"Finance, Financial Services, Venture Capital",,https://openviewpartners.com/,https://openviewpartners.com/,,,"Boston, Massachusetts, United States","Boston, Massachusetts, United States",VC Founds - Seed - US/Europe,Jan-2006,"Debt, Early Stage Venture, Late Stage Venture",Venture Capital,36,128,Active
81f94751-ec22-47a0-93b6-56551da99139,Operator Partners,company,,"Business Development, Finance, Financial Services",,linkedin.com/company/operator-partners/,linkedin.com/company/operator-partners/,,,"New York, New York, United States","New York, New York, United States","All VCs ,VC Founds - Seed - US/Europe",Jan-2020,"Early Stage Venture, Seed",Venture Capital,7,147,Active
6eed3a9c-b47f-4769-98c2-44dd28aa5d1b,OrbiMed,company,,"Angel Investment, Financial Services, Health Care",,orbimed.com,orbimed.com,,,"New York, New York, United States","New York, New York, United States","All VCs ,VC Founds - Seed - US/Europe",Jan-1989,"Debt, Early Stage Venture, Late Stage Venture, Post-Ipo, Private Equity",Private Equity Firm,249,661,Active
a296975e-e191-426a-8651-2f6baf208dad,Oreilly AlphaTech Ventures,company,,"Banking, Finance, Venture Capital",,linkedin.com/company/o'reilly-alphatech-ventures,linkedin.com/company/o'reilly-alphatech-ventures,,,"San Francisco, California, United States","San Francisco, California, United States",VC Founds - Seed - US/Europe,Nov-2006,,"Micro VC, Venture Capital",32,136,Active
e01ab022-d911-454e-9a09-feddf251de5f,Oriza Ventures,company,,"Angel Investment, Big Data, Business Development, Financial Services, Venture Capital",,orizaventures.com,orizaventures.com,,,"Santa Clara, California, United States","Santa Clara, California, United States",VC Founds - Seed - US/Europe,Jan-2015,"Early Stage Venture, Seed",Micro VC,5,47,Active
2c3c8338-4850-47f6-991a-d657d320358d,Outlander VC,company,,"Angel Investment, Finance, Financial Services, Venture Capital",,linkedin.com/company/outlandervc,linkedin.com/company/outlandervc,,,"Atlanta, Georgia, United States","Atlanta, Georgia, United States","All VCs ,VC Founds - Seed - US/Europe",Jan-2020,"Early Stage Venture, Late Stage Venture, Seed, Venture","Fund Of Funds, Startup Competition, Venture Capital",,13,Active
615aa806-a562-40f5-a21b-b92d998c1df3,Outsiders Fund,company,,,,http://www.linkedin.com/company/outsiders-fund,http://www.linkedin.com/company/outsiders-fund,,,"New York, New York, United States","New York, New York, United States",VC Founds - Seed - US/Europe,Jan-2020,"Early Stage Venture, Seed, Venture",Venture Capital,1,24,Active
4068d4b7-9d27-4742-923b-5831549d34de,Oval Park Capital,company,,"Finance, Financial Services, Industrial Automation, InsurTech, Service Industry",,ovalpark.com,ovalpark.com,,,"Raleigh, North Carolina, United States","Raleigh, North Carolina, United States",VC Founds - Seed - US/Europe,Jan-2018,"Early Stage Venture, Seed",Venture Capital,,17,Active
73f93094-c3d3-472d-b14b-f739f6b4849e,Overline,company,,"Finance, Financial Services, Venture Capital",,https://overline.vc/,https://overline.vc/,,,"4675 Lakeway Place, Alpharetta, GA 30005","4675 Lakeway Place, Alpharetta, GA 30005","All VCs ,VC Founds - Seed - US/Europe",Mar-2020,Seed,Venture Capital,1,39,Active
8c5af306-1f36-419c-bfce-d60e373fdea0,P101,company,,"Angel Investment, Finance, Financial Services, Venture Capital",,p101.it,p101.it,,,🇮🇹 Italy,🇮🇹 Italy,VC Founds - Seed - US/Europe,Dec-2013,Early Stage Venture,Venture Capital,15,91,Active
cc7fd82e-4e32-4226-b67c-234558eae01e,P5 Health Ventures,company,,,,p5hv.com,p5hv.com,,,"Fairfield, Connecticut, United States","Fairfield, Connecticut, United States","All VCs ,VC Founds - Seed - US/Europe",Mar-2016,,Venture Capital,1,10,Active
cd536813-8778-4726-ad3d-3ba2f72cb66f,Palm Drive Capital,company,,"Financial Services, Venture Capital",,palmdrive.vc,palmdrive.vc,,,"New York, New York, United States","New York, New York, United States",VC Founds - Seed - US/Europe,Jan-2014,,Venture Capital,17,104,Active
74a028bc-e41b-4dda-af3f-d79eb0da1690,Palo Santo Fund,company,,"Biopharma, Biotechnology, Health Care, Pharmaceutical, Therapeutics, Wellness",,linkedin.com/company/palosantovc/?viewAsMember=true,linkedin.com/company/palosantovc/?viewAsMember=true,,,"Highland Park, Illinois, United States","Highland Park, Illinois, United States",VC Founds - Seed - US/Europe,Jan-2020,Early Stage Venture,Venture Capital,1,12,Active
b865aa7e-4e0d-46b0-8c33-8148f87b8e18,Pappas Capital,company,,"Biotechnology, Delivery, Medical Device, Pharmaceutical",,http://www.pappas-capital.com/,http://www.pappas-capital.com/,,,USA,USA,"All VCs ,VC Founds - Seed - US/Europe",Jan-1994,"Early Stage Venture, Late Stage Venture",Venture Capital,9,30,Active
99e56888-0c4a-41c1-8822-8f4f3383adcf,Parkwalk Advisors,company,,"Finance, Financial Services, Venture Capital",,https://parkwalkadvisors.com/,https://parkwalkadvisors.com/,,,UK,UK,VC Founds - Seed - US/Europe,May-2009,"Early Stage Venture, Late Stage Venture, Venture",Venture Capital,29,312,Active
9575cc92-0828-497e-88ce-8674aa99af78,Partech,company,,"Finance, Financial Services, Venture Capital",,partechpartners.com,partechpartners.com,,,"Paris, Ile-de-France, France","Paris, Ile-de-France, France","All VCs ,VC Founds - Seed - US/Europe",Jan-1982,"Early Stage Venture, Late Stage Venture, Private Equity, Seed",Venture Capital,102,560,Active
9bdad6d6-a09f-482f-9dd1-6d909e6d7ac5,Partner Ventures,company,,,,partnervc.com,partnervc.com,,,"Portola Valley, California, United States","Portola Valley, California, United States",VC Founds - Seed - US/Europe,Oct-2009,,Venture Capital,7,64,Active
af38176d-8488-4667-b022-fe3ea13d4b10,Pasadena Angels,company,,"CleanTech, FinTech, Food and Beverage, Mobile, Personal Health, Small and Medium Businesses, Social Media",,http://www.pasadenaangels.com/,http://www.pasadenaangels.com/,,,"Altadena, California, United States","Altadena, California, United States",VC Founds - Seed - US/Europe,Jan-2000,"Early Stage Venture, Late Stage Venture, Seed",Angel Group,10,52,Active
099be0a5-ae33-458e-a4c4-d544f463cad4,PeakSpan Capital,company,,"B2B, Software, Venture Capital",,https://www.peakspancapital.com/,https://www.peakspancapital.com/,,,Burlingame,Burlingame,"All VCs ,VC Founds - Seed - US/Europe",Jun-2015,Early Stage Venture,Venture Capital,8,45,Active
df733c26-cfdc-440a-b65d-580314f76ae6,Peak State Ventures,company,,"Finance, Financial Services, FinTech, Venture Capital",,peakstate.vc,peakstate.vc,,,"San Francisco, California, United States","San Francisco, California, United States","All VCs ,VC Founds - Seed - US/Europe",Jan-2017,"Early Stage Venture, Late Stage Venture, Seed, Venture",Venture Capital,8,45,Active
b5db171f-9c5d-4835-90c3-ab1371af807a,Pear VC,company,,"Angel Investment, Education, Finance, Venture Capital",,https://www.pear.vc/,https://www.pear.vc/,,,"158 South Park St, San Francisco, CA","158 South Park St, San Francisco, CA",VC Founds - Seed - US/Europe,Jan-2013,"Early Stage Venture, Seed",Venture Capital,25,359,Active
f42b6d48-a771-4294-a14a-1334efc9d4ea,Pegasus Tech Ventures,company,,"Business Development, Financial Services, FinTech, Venture Capital",,https://www.pegasustechventures.com/,https://www.pegasustechventures.com/,,,"San Jose, California, United States","San Jose, California, United States","All VCs ,VC Founds - Seed - US/Europe",Jan-2011,"Early Stage Venture, Seed",Venture Capital,51,244,Active
ccb28407-31a0-43dd-bf2c-b7216b5d9538,Pembroke VCT,company,,"Apparel, Finance, Financial Services, Venture Capital",,https://www.pembrokevct.com/,https://www.pembrokevct.com/,,,"3 Cadogan Gate, Chelsea, London, SW1x 0AS","3 Cadogan Gate, Chelsea, London, SW1x 0AS",VC Founds - Seed - US/Europe,Jan-2013,"Early Stage Venture, Late Stage Venture",Venture Capital,2,50,Active
c5f257a7-80a4-4000-8298-3667501807c6,Pentas Ventures,company,,,,linkedin.com/company/74748630/admin/,linkedin.com/company/74748630/admin/,,,"Brooklyn, New York, United States","Brooklyn, New York, United States",VC Founds - Seed - US/Europe,Jan-2021,"Early Stage Venture, Seed",Venture Capital,1,23,Active
f10bcda5-c44e-4ea3-909b-d24244e58a2f,Perceptive Advisors,company,,"Finance, Financial Services, Venture Capital",,perceptivelife.com,perceptivelife.com,,,"New York, New York, United States","New York, New York, United States",VC Founds - Seed - US/Europe,Jan-1999,"Early Stage Venture, Late Stage Venture, Private Equity","Hedge Fund, Micro VC",138,260,Active
53869a9b-f0fd-4740-92ba-1494ae325323,Peregrine Ventures,company,,"Enterprise Software, Life Science, Medical Device, Pharmaceutical, Venture Capital",,http://www.peregrinevc.com,http://www.peregrinevc.com,,,"Or Yehuda, Tel Aviv, Israel","Or Yehuda, Tel Aviv, Israel",VC Founds - Seed - US/Europe,Jan-2001,"Early Stage Venture, Late Stage Venture, Seed, Venture","Incubator, Micro VC, Venture Capital",12,89,Active
0c2a167d-c48e-4510-be3e-60db50dd5983,Perot Jain,company,,,,perotjain.com,perotjain.com,,,"Dallas, Texas, United States","Dallas, Texas, United States","All VCs ,VC Founds - Seed - US/Europe",Jan-2014,,"Micro VC, Venture Capital",4,40,Active
62045676-f299-4ec9-8787-b274b2634db9,Peterson Partners,company,,"Angel Investment, Asset Management, Financial Services, Venture Capital",,petersonpartners.com,petersonpartners.com,,,Salt Lake City,Salt Lake City,VC Founds - Seed - US/Europe,Jan-1995,"Early Stage Venture, Private Equity, Seed","Private Equity Firm, Venture Capital",3,21,Active
66983a27-975d-4e94-8d63-be0bef330e73,Peterson Ventures,company,,"Financial Services, FinTech, Venture Capital",,https://www.petersonpartners.com/,https://www.petersonpartners.com/,,,"Salt Lake City, Utah, United States","Salt Lake City, Utah, United States","All VCs ,VC Founds - Seed - US/Europe",Aug-2008,"Early Stage Venture, Seed",Venture Capital,24,232,Active
7d4f6279-2178-4682-af1e-146ae32a51d8,PFM Health Sciences,company,,"Financial Services, Health Care, Venture Capital",,linkedin.com/company/partner-fund-management/,linkedin.com/company/partner-fund-management/,,,"San Francisco, California, United States","San Francisco, California, United States","All VCs ,VC Founds - Seed - US/Europe",Jan-2004,Early Stage Venture,Venture Capital,9,19,Active
8a2128d4-b699-41b4-b804-80bffc0cbb62,PICO Venture Partners,company,,"Apparel, Business Development, Finance, Financial Services",,linkedin.com/company/pico-venture-partners,linkedin.com/company/pico-venture-partners,,,🇮🇱 Israel,🇮🇱 Israel,VC Founds - Seed - US/Europe,Aug-2015,"Early Stage Venture, Seed",Venture Capital,5,63,Active
030b1b35-d953-42bd-a6c4-1783ea75b616,Pitango VC,company,,"Banking, DevOps, Financial Services, FinTech, Health Care, Information Technology, Venture Capital, Web3",,linkedin.com/company/pitango-venture-capital,linkedin.com/company/pitango-venture-capital,,,"Herzliya, Tel Aviv, Israel","Herzliya, Tel Aviv, Israel",VC Founds - Seed - US/Europe,Jan-1993,"Early Stage Venture, Late Stage Venture, Seed",Venture Capital,65,360,Active
7c9326a9-fe91-4c8b-8987-51d5be657a92,PJC,company,,"Artificial Intelligence (AI), Consumer, Enterprise, FinTech, InsurTech, Venture Capital",,http://pjc.vc/,http://pjc.vc/,,,USA,USA,"All VCs ,VC Founds - Seed - US/Europe",Jan-2001,"Early Stage Venture, Seed",Venture Capital,26,126,Active
d718c820-e3c2-4452-a959-954c91a4fb36,Plains Ventures,company,,"Finance, Financial Exchanges, Financial Services",,linkedin.com/company/plainsvc,linkedin.com/company/plainsvc,,,"Oklahoma City, Oklahoma, United States","Oklahoma City, Oklahoma, United States",VC Founds - Seed - US/Europe,Jan-2019,"Early Stage Venture, Seed",Venture Capital,,5,Active
d5f292a4-f46a-497f-ab85-709101e92cdf,Point72 Ventures,company,,"Artificial Intelligence (AI), Enterprise Software, Financial Services, FinTech",,https://p72.vc/,https://p72.vc/,,,"Sand Hill Road, Menlo Park, CA, USA 94025","Sand Hill Road, Menlo Park, CA, USA 94025","All VCs ,VC Founds - Seed - US/Europe",Mar-2016,"Early Stage Venture, Seed, Venture",Venture Capital,20,173,Active
ef6b8a7c-f1f6-44d1-b05f-5f2c231622e7,Powerhouse Capital,company,,"Audio, Events, Gaming, Media and Entertainment, Music, Ticketing, Video, Video Games",,powerhouse.vc,powerhouse.vc,,,"Los Angeles, California, United States","Los Angeles, California, United States","All VCs ,VC Founds - Seed - US/Europe",Jan-2019,"Early Stage Venture, Late Stage Venture, Private Equity, Seed",Venture Capital,4,22,Active
3af79a83-0b02-4dca-88fb-a2cdd03560a4,Predictive VC,company,,"Finance, Financial Services, Venture Capital",,linkedin.com/company/predictive-venture-partners/,linkedin.com/company/predictive-venture-partners/,,,,,VC Founds - Seed - US/Europe,Jan-2020,,Venture Capital,,23,Active
f35755ed-d578-4018-880d-0434f213d4c9,Prefix Capital,company,,"Finance, Financial Services, Venture Capital",,prefixcapital.com,prefixcapital.com,,,"San Francisco, California, United States","San Francisco, California, United States","All VCs ,VC Founds - Seed - US/Europe",Jan-2019,"Convertible Note, Early Stage Venture, Seed",Venture Capital,,13,Active
fb6b1fd1-5b6d-4fe8-bb2b-8e7097467119,Primary Venture Partners,company,,"Developer Tools, E-Commerce, FinTech, Generative AI, Health Care, Manufacturing, PropTech, Small and Medium Businesses, Supply Chain Management",,https://www.primary.vc/,https://www.primary.vc/,,,"New York, New York, United States","New York, New York, United States",VC Founds - Seed - US/Europe,Jan-2015,"Early Stage Venture, Seed",Venture Capital,31,171,Active
6ce0731b-54e3-47a4-bc49-32cf13127ee2,Prime Movers Lab,company,,"Finance, Life Science, Venture Capital",,https://www.primemoverslab.com/,https://www.primemoverslab.com/,,,"Jackson, Wyoming, United States","Jackson, Wyoming, United States","All VCs ,VC Founds - Seed - US/Europe",Jan-2018,"Early Stage Venture, Late Stage Venture, Seed",Venture Capital,4,59,Active
454acedd-2a61-4b7e-862b-c9b3a65bec07,Primera Capital,company,,"Consumer, SaaS, Venture Capital",,primeracapital.com,primeracapital.com,,,"Oakland, California, United States","Oakland, California, United States",VC Founds - Seed - US/Europe,Jan-2007,"Early Stage Venture, Late Stage Venture, Seed",Venture Capital,8,35,Active
2bd05500-48bb-431a-a500-4773cb71dfe9,Primetime Partners,company,,"Business Development, Finance, Financial Services, Venture Capital",,linkedin.com/company/primetime-partners/,linkedin.com/company/primetime-partners/,,,"New York, New York, United States","New York, New York, United States","All VCs ,VC Founds - Seed - US/Europe",Jan-2020,,Venture Capital,,38,Active
22246231-891a-4a6e-b30a-2e0c9bd11719,Primus Capital Partners,company,,"Education, Financial Services, FinTech, Health Care, Information Technology, Internet, Software",,linkedin.com/company/1251496,linkedin.com/company/1251496,,,"Cleveland, Ohio, United States","Cleveland, Ohio, United States",VC Founds - Seed - US/Europe,Jan-1984,,Private Equity Firm,10,26,Active
29e84f3d-4b54-4426-a62d-72bea41cf559,Progression Fund,company,,,,https://www.progression.fund/,https://www.progression.fund/,,,"San Francisco, USA","San Francisco, USA","All VCs ,VC Founds - Seed - US/Europe",Jan-2020,"Early Stage Venture, Seed",Venture Capital,3,34,Active
7c198fd1-8445-4102-b7ec-43814892eeed,Propel VC,company,,"Cryptocurrency, Financial Services, FinTech, Insurance, InsurTech, Venture Capital, Web3",,linkedin.com/company/propel-venture-partners,linkedin.com/company/propel-venture-partners,,,"San Carlos, California, United States","San Carlos, California, United States",VC Founds - Seed - US/Europe,Feb-2016,"Early Stage Venture, Seed, Venture",Venture Capital,11,58,Active
406c67f0-6106-4835-a216-d3b47d784397,PS27 Ventures,company,,"Biotechnology, Clean Energy, CleanTech, E-Commerce, FinTech, Health Care, Software, Sustainability",,linkedin.com/company/9250227,linkedin.com/company/9250227,,,"Jacksonville, Florida, United States","Jacksonville, Florida, United States",VC Founds - Seed - US/Europe,Jan-2013,"Convertible Note, Early Stage Venture, Seed",Venture Capital,3,20,Active
4a4fccad-2757-4e09-9e3b-27fb3f07a89a,PTV Healthcare Capital,company,,"Health Care, Health Diagnostics, Venture Capital",,ptvhc.com,ptvhc.com,,,"Austin, Texas, United States","Austin, Texas, United States",VC Founds - Seed - US/Europe,Jan-2003,"Early Stage Venture, Late Stage Venture",Venture Capital,13,34,Active
fe41bd79-f1e2-4efc-9a0c-74ea06bb1cff,Pure Imagination Brands,company,,"Business Development, Finance, Financial Services",,linkedin.com/company/pure-imagination-brands/,linkedin.com/company/pure-imagination-brands/,,,"Santa Monica, California, United States","Santa Monica, California, United States",VC Founds - Seed - US/Europe,Jan-2019,,Venture Capital,2,51,Active
e4a822c7-428b-4ccc-ae65-3a4acc9fe7bd,Pureos Bioventures,company,,,,https://www.pureosbio.com/en/,https://www.pureosbio.com/en/,,,"Küsnacht, Zurich, Switzerland","Küsnacht, Zurich, Switzerland",VC Founds - Seed - US/Europe,,"Early Stage Venture, Seed, Venture",Venture Capital,3,25,Active
c5b843d4-2cf9-49a8-b31f-18b7eb3c3028,Qatar Investment Authority,company,,"Asset Management, Banking, Finance, Financial Services, Government",,qia.qa,qia.qa,,,"Doha, Ad Dawhah, Qatar","Doha, Ad Dawhah, Qatar",VC Founds - Seed - US/Europe,Jan-2005,"Late Stage Venture, Private Equity","Government Office, Private Equity Firm",27,87,Active
4875f8ad-3cf9-47db-9525-e3ec6c0ca009,QED Investors,company,,"Business Development, Business Intelligence, Financial Services, FinTech",,https://qedinvestors.com/,https://qedinvestors.com/,,,"Alexandria, Virginia, United States","Alexandria, Virginia, United States","All VCs ,VC Founds - Seed - US/Europe",Jan-2007,"Early Stage Venture, Late Stage Venture, Private Equity, Seed",Venture Capital,39,321,Active
248fed1c-3cac-427e-bbc0-06d951e1a319,Quadrille Capital,company,,"Finance, Financial Services, Venture Capital",,quadrillecapital.com,quadrillecapital.com,,,🇫🇷 France,🇫🇷 France,"All VCs ,VC Founds - Seed - US/Europe",Jan-2001,"Early Stage Venture, Late Stage Venture, Private Equity",Venture Capital,11,45,Active
d40dfbf9-0ed0-49c5-9729-4a9685f1787e,Quaker Partners,company,,,,linkedin.com/company/quaker-partners,linkedin.com/company/quaker-partners,,,"Philadelphia, Pennsylvania, United States","Philadelphia, Pennsylvania, United States",VC Founds - Seed - US/Europe,Jan-2002,"Early Stage Venture, Late Stage Venture",Venture Capital,6,15,Active
ea512f8f-810e-434e-b61b-dcd620fd9056,Quarry,company,,Venture Capital,,quarry.vc,quarry.vc,,,"San Francisco, California, United States","San Francisco, California, United States",VC Founds - Seed - US/Europe,Jan-2018,Venture,Venture Capital,3,20,Active
b392751f-2390-4282-a3bf-93f29e471ed4,Quiet Capital,company,,"Financial Services, Internet, IT Infrastructure, Venture Capital",,https://www.quiet.com/,https://www.quiet.com/,,,"San Francisco, California","San Francisco, California","All VCs ,VC Founds - Seed - US/Europe",Jan-2017,"Early Stage Venture, Late Stage Venture, Seed, Venture",Venture Capital,24,345,Active
ecca4dc2-336b-4a47-9e0f-b2180bcce722,R7 Partners,company,,"AgTech, Air Transportation, Enterprise Software, Finance, FinTech, Robotics, Transportation",,https://r7.vc/,https://r7.vc/,,,Chicago,Chicago,VC Founds - Seed - US/Europe,Jan-2014,"Early Stage Venture, Seed","Private Equity Firm, Venture Capital",2,25,Active
54c4922e-ef8d-457f-8e23-85ec0e91412c,RA Capital Management,company,,"Biotechnology, Finance, Financial Services, Life Science, Medical",,https://www.racap.com/,https://www.racap.com/,,,"Boston, Massachusetts, United States","Boston, Massachusetts, United States",VC Founds - Seed - US/Europe,Jan-2001,"Early Stage Venture, Late Stage Venture, Post-Ipo, Private Equity","Private Equity Firm, Venture Capital",175,386,Active
86298e8f-4d44-4023-ba2e-2553561a9703,Radian Capital,company,,"Business Development, Consulting, Management Information Systems",,radiancapital.com,radiancapital.com,,,"New York, New York, United States","New York, New York, United States","All VCs ,VC Founds - Seed - US/Europe",Feb-2016,,Venture Capital,5,22,Active
dc6a199f-c3b5-4ca4-9d6a-1eb07cd9c1e4,Radical Ventures,company,,"Finance, Financial Services, Venture Capital",,https://radical.vc/,https://radical.vc/,,,"661 University Ave #470, Toronto, ON M5G 1M1, Canada","661 University Ave #470, Toronto, ON M5G 1M1, Canada","All VCs ,VC Founds - Seed - US/Europe",Jan-2017,"Early Stage Venture, Seed, Venture",Venture Capital,5,73,Active
7fc0480d-c7f9-4f0b-9599-899552be5d2e,Radius Ventures,company,,"Finance, Financial Services, Venture Capital",,radiusventures.com,radiusventures.com,,,"New York, New York, United States","New York, New York, United States","All VCs ,VC Founds - Seed - US/Europe",Jan-1997,"Early Stage Venture, Late Stage Venture",Venture Capital,16,46,Active
16cc8b0a-2c67-4c4d-aeba-dfc62f4aa376,Raga Partners,company,,"Finance, Financial Services, Venture Capital",,linkedin.com/company/ragapartners,linkedin.com/company/ragapartners,,,"New York, New York, United States","New York, New York, United States",VC Founds - Seed - US/Europe,Jan-2013,Early Stage Venture,Venture Capital,,12,Active
c29f91f4-9a9b-477e-a4cb-14b413a27e39,Rainfall Ventures,company,,Venture Capital,,rainfall.com,rainfall.com,,,"New York, New York, United States","New York, New York, United States","All VCs ,VC Founds - Seed - US/Europe",Jan-2011,"Convertible Note, Early Stage Venture, Seed, Venture",Venture Capital,23,100,Active
d07286e0-7aa1-46d9-9066-87dc373cdb2e,Rally Ventures,company,,"Finance, Financial Services, Venture Capital",,rallyventures.com,rallyventures.com,,,"Menlo Park, California, United States","Menlo Park, California, United States","All VCs ,VC Founds - Seed - US/Europe",Jan-2012,"Early Stage Venture, Seed",Venture Capital,26,129,Active
22908557-ca1e-41ad-bf16-96eff2f58bfd,REDO Ventures,company,,"Financial Services, Impact Investing, Venture Capital",,redoventures.com,redoventures.com,,,"West New York, New Jersey, United States","West New York, New Jersey, United States",VC Founds - Seed - US/Europe,Jan-2017,Early Stage Venture,Venture Capital,1,13,Active
ff07172a-b53c-43ca-8905-c4c76fddd499,Redseed,company,,Venture Capital,,redseed.vc,redseed.vc,,,,,VC Founds - Seed - US/Europe,Jan-2015,"Early Stage Venture, Seed",Venture Capital,,12,Active
441ce2b7-0e2d-4b02-ab72-93fa142e13d8,Refinery Ventures,company,,"Information Technology, Venture Capital",,refinery.com,refinery.com,,,"Cincinnati, Ohio, United States","Cincinnati, Ohio, United States",VC Founds - Seed - US/Europe,Jan-2017,Early Stage Venture,Venture Capital,2,20,Active
2d259bb5-bec5-40d1-add0-71113040d310,Revolution,company,,"Business Development, Finance, Financial Services, Venture Capital",,https://www.revolution.com/,https://www.revolution.com/,,,"Washington, District of Columbia, United States","Washington, District of Columbia, United States","All VCs ,VC Founds - Seed - US/Europe",Apr-2005,"Early Stage Venture, Late Stage Venture, Seed",Venture Capital,67,262,Active
5e387bed-66f5-48a4-a466-0d18346bd2cb,Rho Capital Partners,company,,"Finance, Financial Services, Venture Capital",,https://www.rho.com/,https://www.rho.com/,,,"New York, New York, United States","New York, New York, United States","All VCs ,VC Founds - Seed - US/Europe",Jan-1981,"Early Stage Venture, Late Stage Venture, Private Equity","Private Equity Firm, Venture Capital",43,113,Active
d843bbd2-6d1f-4c5d-b4ab-601c9d42a44b,Richmond View Ventures,company,,"B2B, B2C, Financial Services, Internet",,https://rvv.tv,https://rvv.tv,,,Mehringdamm 55 -  10961 Berlin,Mehringdamm 55 -  10961 Berlin,VC Founds - Seed - US/Europe,Jan-2007,,Angel Group,3,11,Active
abe70e38-74a9-42ef-ad4d-5dd22cab9459,RiverVest,company,,"Business Development, Finance, Financial Services, Venture Capital",,linkedin.com/company/2514161,linkedin.com/company/2514161,,,"St Louis, Missouri, United States","St Louis, Missouri, United States",VC Founds - Seed - US/Europe,Jan-2000,"Early Stage Venture, Late Stage Venture",Venture Capital,27,85,Active
2fcdf1ad-934e-4e0a-81d5-28c5f4aba0d6,RKKVC,company,,,,linkedin.com/company/rkkvc/?originalSubdomain=pl,linkedin.com/company/rkkvc/?originalSubdomain=pl,,,"Warszawa, Mazowieckie, Poland","Warszawa, Mazowieckie, Poland",VC Founds - Seed - US/Europe,Jan-2020,"Early Stage Venture, Late Stage Venture, Seed, Venture",Venture Capital,1,15,Active
43f0d4ca-aa3c-4192-bc87-6379e8038dbb,Robin Hood Ventures,company,,Enterprise Software,,http://www.robinhoodventures.com/,http://www.robinhoodventures.com/,,,"Philadelphia, Pennsylvania, United States","Philadelphia, Pennsylvania, United States",VC Founds - Seed - US/Europe,Jan-1999,"Early Stage Venture, Late Stage Venture, Seed",Angel Group,14,132,Active
fcec16ee-a264-44cc-81f2-ce39454b0ebe,Rock Creek Capital,company,,"Finance, Financial Services, Venture Capital",,rockcreekcapllc.com,rockcreekcapllc.com,,,"Jacksonville, Florida, United States","Jacksonville, Florida, United States","All VCs ,VC Founds - Seed - US/Europe",Feb-2019,"Early Stage Venture, Private Equity","Private Equity Firm, Venture Capital",3,14,Active
