id,name,contactType,favoriteEmail,description,emails,favoriteUrl,urls,favoritePhone,phones,favoriteAddress,addresses,groups,Founded Date,Investment Stage,Investor Type,Number of Exits,Number of Investments,Operating Status
09ff467b-f2ac-4b3c-8369-1fde85afa861,Suvretta Capital Management,company,,,,linkedin.com/company/suvretta-capital-management-llc,linkedin.com/company/suvretta-capital-management-llc,,,"New York, New York, United States","New York, New York, United States",VC Founds - Seed - US/Europe,Jan-2011,,Venture Capital,16,23,Active
d52c2b3b-86f1-4e07-b2ce-07ecd77443ea,SV Health Investors,company,,"Biotechnology, Health Care, Life Science, Medical Device, Venture Capital",,linkedin.com/company/sv-health-investors/,linkedin.com/company/sv-health-investors/,,,"Boston, Massachusetts, United States","Boston, Massachusetts, United States","All VCs ,VC Founds - Seed - US/Europe",Jan-1993,"Debt, Early Stage Venture, Late Stage Venture",Venture Capital,88,308,Active
70009ceb-c513-4d54-a679-6bfb818f822b,SWaN & Legend Venture Partners,company,,"Financial Services, Venture Capital",,https://www.swanandlegend.com/,https://www.swanandlegend.com/,,,"Leesburg, VA, USA","Leesburg, VA, USA","All VCs ,VC Founds - Seed - US/Europe",Jan-2012,Early Stage Venture,Venture Capital,6,35,Active
f3d4b1fa-2a5a-437e-ae96-1c8f8f4cc78f,Sweet Capital,company,,"Consumer, Mobile, Venture Capital",,https://sweetcapital.com/,https://sweetcapital.com/,,,"London, UK","London, UK",VC Founds - Seed - US/Europe,Jul-2015,"Early Stage Venture, Seed",Venture Capital,5,59,Active
894cbaca-d59f-42ff-864f-d7cdee4aabbb,SWS Venture Capital,company,,"Consumer, Financial Services, FinTech, Information Technology, Venture Capital",,linkedin.com/company/sws-venture-capital,linkedin.com/company/sws-venture-capital,,,"Los Angeles, California, United States","Los Angeles, California, United States",VC Founds - Seed - US/Europe,Jan-2018,"Early Stage Venture, Late Stage Venture, Seed",Venture Capital,3,20,Active
969b5836-b887-42a3-8e7d-05df8982fc5d,TA Associates,company,,"Finance, Financial Services, Venture Capital",,without the 'www.'ta.com,without the 'www.'ta.com,,,Boston,Boston,VC Founds - Seed - US/Europe,Jan-1968,"Debt, Early Stage Venture, Late Stage Venture, Private Equity",Private Equity Firm,176,290,Active
f46c6211-81b5-4c96-96b5-b7ac5757e444,Talis Capital,company,,"Finance, Financial Services, FinTech, Venture Capital",,https://www.taliscapital.com,https://www.taliscapital.com,,,UK,UK,VC Founds - Seed - US/Europe,Jan-2009,"Early Stage Venture, Seed, Venture",Venture Capital,16,77,Active
6e66b46a-bdec-42ac-b6ae-2e5a224eb7af,Tal Ventures,company,,Tal Ventures is an Israeli-based venture capital firm investing in early stage and growth companies.,,linkedin.com/company/tal-ventures,linkedin.com/company/tal-ventures,,,"Tel Aviv, Tel Aviv, Israel","Tel Aviv, Tel Aviv, Israel","All VCs ,VC Founds - Seed - US/Europe",Jan-2021,"Early Stage Venture, Late Stage Venture, Seed",Venture Capital,,36,Active
5c706d3a-5b13-43ca-b0d1-cfe91ba4a3d8,Tamarind Hill,company,,"Health Care, Information Technology, SaaS, Software",,tamarind-hill.com,tamarind-hill.com,,,"Ann Arbor, Michigan, United States","Ann Arbor, Michigan, United States",VC Founds - Seed - US/Europe,Nov-2016,"Early Stage Venture, Seed",Micro VC,3,19,Active
abfccf60-b34f-4104-92b3-50132161503b,Tarsadia Investments,company,,"Business Development, Finance, Financial Services, Venture Capital",,linkedin.com/company/tarsadia-investments,linkedin.com/company/tarsadia-investments,,,"Newport Beach, California, United States","Newport Beach, California, United States",VC Founds - Seed - US/Europe,Jan-1976,Private Equity,Private Equity Firm,6,38,Active
83be1475-6650-4552-af7d-b1c9c2d56b4f,Tau Ventures,company,,"Finance, Financial Services, Venture Capital",,tauventures.com,tauventures.com,,,"Palo Alto, California, United States","Palo Alto, California, United States","All VCs ,VC Founds - Seed - US/Europe",Jan-2019,"Early Stage Venture, Seed",Venture Capital,3,51,Active
10ceed5b-bb34-4918-ac43-8cb7579a503a,Taver Capital Partners,company,,"Artificial Intelligence (AI), Financial Services, Venture Capital",,linkedin.com/company/taver-capital-partners/,linkedin.com/company/taver-capital-partners/,,,"Wilmington, Delaware, United States","Wilmington, Delaware, United States",VC Founds - Seed - US/Europe,Dec-2014,"Early Stage Venture, Non Equity Assistance, Seed",Venture Capital,2,26,Active
242f6387-6698-4007-8734-efc170175b9d,Tavistock Life Sciences,company,,Asset Management,,linkedin.com/company/tavistock-group,linkedin.com/company/tavistock-group,,,"Windermere, Florida, United States","Windermere, Florida, United States",VC Founds - Seed - US/Europe,Jan-1975,"Early Stage Venture, Late Stage Venture",Venture Capital,15,24,Active
8b1be468-479c-4ad7-b35c-201f391d840c,TCG,company,,"Digital Media, Film Production, Media and Entertainment, TV Production, Venture Capital",,tcg.co,tcg.co,,,"Los Angeles, California, United States","Los Angeles, California, United States","All VCs ,VC Founds - Seed - US/Europe",Jan-2010,"Early Stage Venture, Late Stage Venture, Private Equity, Seed",Venture Capital,22,112,Active
1872e67c-8ce4-410d-9964-dd4896156208,TCG Crossover,company,,"Alternative Medicine, Financial Services, Health Care, Life Science, Venture Capital",,linkedin.com/company/tcg-crossover,linkedin.com/company/tcg-crossover,,,"Palo Alto, California, United States","Palo Alto, California, United States",VC Founds - Seed - US/Europe,Jan-2020,,"Hedge Fund, Venture Capital",27,43,Active
ad65216d-c4ab-4e4b-8a97-9ec349b692d4,Team Builder Ventures,company,,"Consumer, Enterprise Software, Internet, Venture Capital",,https://www.teambuilderventures.com/,https://www.teambuilderventures.com/,,,San Francisco,San Francisco,VC Founds - Seed - US/Europe,Jan-2013,,Venture Capital,5,30,Active
c900c7eb-3b4e-44a0-8fd1-db1920c64d41,Teamworthy Ventures,company,,"Financial Services, Software, Venture Capital",,teamworthy.com,teamworthy.com,,,New York,New York,"All VCs ,VC Founds - Seed - US/Europe",Nov-2014,"Early Stage Venture, Late Stage Venture, Seed, Venture",Venture Capital,8,59,Active
d28ace84-25f0-4315-988b-e2b3915a9f46,Techammer,company,,"Analytics, Big Data, Enterprise Software, FinTech, Venture Capital",,techammer.co,techammer.co,,,"New York, New York, United States","New York, New York, United States",VC Founds - Seed - US/Europe,Jan-2007,Seed,Angel Group,36,83,Active
603f5e66-888f-409d-95d9-7efd33d87daa,TechNexus Venture Collaborative,company,,"B2B, B2C, Business Development, Venture Capital",,technexus.com,technexus.com,,,Illinois,Illinois,"All VCs ,VC Founds - Seed - US/Europe",Jan-2007,"Convertible Note, Early Stage Venture, Seed","Incubator, Venture Capital",18,256,Active
e1f5fe2b-8c30-4fc7-8e82-5009ed653b59,Tectonic Ventures,company,,Software,,tectonicventures.com,tectonicventures.com,,,"Cambridge, Massachusetts, United States","Cambridge, Massachusetts, United States","All VCs ,VC Founds - Seed - US/Europe",Jan-2016,,Venture Capital,3,32,Active
92c28995-a780-4537-b59b-17894d889780,TEDCO,company,,"Consulting, Financial Services, Information Technology, Venture Capital",,tedcomd.com,tedcomd.com,,,"Columbia, Maryland, United States","Columbia, Maryland, United States","All VCs ,VC Founds - Seed - US/Europe",Jan-1998,"Debt, Early Stage Venture, Seed","Government Office, Venture Capital",19,206,Active
ec6b0084-5157-4dbc-ab43-d253d8a2d7e6,Tekla Capital Management,company,,"Finance, Financial Services, Health Care, Venture Capital",,teklacap.com,teklacap.com,,,"Boston, Massachusetts, United States","Boston, Massachusetts, United States",VC Founds - Seed - US/Europe,Jun-1986,"Early Stage Venture, Late Stage Venture",Venture Capital,25,50,Active
841883e6-066f-442a-8649-94dd3dbdc4ab,Telegraph Hill Capital,company,,"Apps, Enterprise Software, Mobile",,http://www.thcap.com/,http://www.thcap.com/,,,USA,USA,VC Founds - Seed - US/Europe,Apr-2007,"Early Stage Venture, Late Stage Venture, Seed",Venture Capital,12,64,Active
07539168-86ad-49c1-a99f-eedc99f0109b,Telstra Ventures,company,info@telstraventures.com,Telstra Ventures invests in technology companies and offers synergy revenues to its portfolio companies.,info@telstraventures.com,https://telstraventures.com/,https://telstraventures.com/,,,"575 Market Suite Suite 1650 San Francisco, CA 94105 USA","575 Market Suite Suite 1650 San Francisco, CA 94105 USA","Corporate Venture Arms,All VCs ,VC Founds - Seed - US/Europe",Jan-2011,"Early Stage Venture, Late Stage Venture, Venture","Corporate Venture Capital, Venture Capital",32,126,Active
d1370c06-1b57-4bd8-8bdb-5be1e68da0d9,Temerity Capital Partners,company,,Long duration capital for dynamic leadership teams building businesses where regulatory hurdles or unmet end-user needs exist,,linkedin.com/company/temerity-capital-partners/,linkedin.com/company/temerity-capital-partners/,,,"Washington, District of Columbia, United States","Washington, District of Columbia, United States",VC Founds - Seed - US/Europe,Jan-2015,"Convertible Note, Debt, Private Equity, Secondary Market, Venture",Venture Capital,4,20,Active
ea5a92aa-58c6-4a71-bb17-d0208edc50c8,Tenaya Capital,company,,"Enterprise Software, Venture Capital",,https://www.tenayacapital.com/,https://www.tenayacapital.com/,,,"Portola Valley, California, United States","Portola Valley, California, United States","All VCs ,VC Founds - Seed - US/Europe",Jan-2009,"Early Stage Venture, Late Stage Venture, Private Equity",Venture Capital,67,184,Active
02b9a109-72e1-4c08-aa21-3e53a08ebdad,TEXO Ventures,company,,"Finance, Health Care, Venture Capital",,http://www.texoventures.com/,http://www.texoventures.com/,,,"Austin, Texas, United States","Austin, Texas, United States","All VCs ,VC Founds - Seed - US/Europe",Sep-2009,"Early Stage Venture, Seed",Venture Capital,2,30,Active
1e74c576-0d55-4738-9955-d6abeef60348,The Column Group,company,,"Biotechnology, Finance, Financial Services, Venture Capital",,thecolumngroup.com,thecolumngroup.com,,,"San Francisco, California, United States","San Francisco, California, United States","All VCs ,VC Founds - Seed - US/Europe",Jan-2006,"Early Stage Venture, Late Stage Venture, Private Equity, Seed",Venture Capital,20,114,Active
1a0d2563-2949-42d6-b777-5cb60d465d7b,The London Fund,company,,"Apps, Blockchain, Direct Marketing, Finance, Financial Services, Food and Beverage, Marketing, Retail, Social Media, Social Media Marketing",,thelondonfund.com,thelondonfund.com,,,"Boston, Massachusetts, United States","Boston, Massachusetts, United States",VC Founds - Seed - US/Europe,Jan-2003,"Early Stage Venture, Late Stage Venture, Private Equity, Seed, Venture","Private Equity Firm, Venture Capital",5,25,Active
9b57cf7b-4e72-484e-9757-cc0bc021082b,TheVentureCity,company,,"TheVentureCity is a global early stage venture fund, investing in product-centric startups across the US, Europe and Latam.",,https://theventure.city/,https://theventure.city/,,,"2234 SW 8th Street, Miami, FL 33135, United States","2234 SW 8th Street, Miami, FL 33135, United States","All VCs ,VC Founds - Seed - US/Europe",Jan-2017,"Early Stage Venture, Seed","Accelerator, Venture Capital",8,133,Active
9f5f58b5-5c50-483c-8357-4e6f368e9e5f,The Venture Collective,company,,"TVC is a transformational, early-stage venture firm backed by world class entrepreneurs and business leaders.",,http://www.theventurecollective.com,http://www.theventurecollective.com,,,"New York, New York, United States","New York, New York, United States",VC Founds - Seed - US/Europe,Oct-2019,"Early Stage Venture, Seed","Family Investment Office, Venture Capital",1,42,Active
db938d71-f60d-49c6-a0f3-d79b19ae3db0,Third Prime,company,,"Finance, Financial Services, Venture Capital",,https://www.thirdprime.vc/,https://www.thirdprime.vc/,,,"18 E 50th St, New York, NY 10022","18 E 50th St, New York, NY 10022","All VCs ,VC Founds - Seed - US/Europe",Jan-2016,"Early Stage Venture, Seed",Venture Capital,6,119,Active
2e5014e2-5368-4c35-a503-5084de71e87e,THL,company,,"Business Development, Financial Services, Impact Investing, Venture Capital, Wealth Management",,linkedin.com/company/thomas-h-lee-partners,linkedin.com/company/thomas-h-lee-partners,,,"Boston, Massachusetts, United States","Boston, Massachusetts, United States",VC Founds - Seed - US/Europe,Jul-1974,,"Private Equity Firm, Venture Capital",10,29,Active
99159800-0d26-4a8b-b1bf-873419da64b8,Threshold,company,,"Business Development, Finance, Financial Services, Venture Capital",,https://threshold.vc/,https://threshold.vc/,,,"Menlo Park, California, United States","Menlo Park, California, United States",VC Founds - Seed - US/Europe,Jan-2019,Early Stage Venture,Venture Capital,20,147,Active
af8a0cab-4f16-4053-a80b-422981f9897e,Thrive Capital,company,,"Finance, Financial Services, Software, Venture Capital",,https://www.thrivecap.com/,https://www.thrivecap.com/,,,"New York, New York, United States","New York, New York, United States","All VCs ,VC Founds - Seed - US/Europe",Jan-2009,"Early Stage Venture, Late Stage Venture, Seed","Incubator, Venture Capital",70,334,Active
a0877c6e-48e3-42c1-86c0-4227ef05cd16,Titan Capital,company,,"Financial Services, Venture Capital",,http://www.linkedin.com/company/titan-capital-vc,http://www.linkedin.com/company/titan-capital-vc,,,"Gurgaon, Haryana, India","Gurgaon, Haryana, India","All VCs ,VC Founds - Seed - US/Europe",Jan-2015,"Early Stage Venture, Seed",Venture Capital,7,232,Active
11e51542-5f50-4aac-8289-d619c428829d,TitletownTech,company,,"Financial Services, Venture Capital",,titletowntech.com,titletowntech.com,,,"Green Bay, Wisconsin, United States","Green Bay, Wisconsin, United States","All VCs ,VC Founds - Seed - US/Europe",Jan-2019,"Early Stage Venture, Seed",Venture Capital,1,31,Active
fce4a660-7c82-4672-bcc6-2ba1a711549f,TMV,company,,"Education, Financial Services, FinTech, Health Care, Information Technology, Internet, Logistics, Transportation, Venture Capital",,https://tmv.vc/team/,https://tmv.vc/team/,,,"New York, New York, United States","New York, New York, United States","All VCs ,VC Founds - Seed - US/Europe",Jan-2016,"Early Stage Venture, Secondary Market, Seed",Venture Capital,8,59,Active
0bf1a454-c31f-4f4a-8d22-3871b5152a7a,Toba Capital,company,,"Information Technology, Venture Capital",,http://www.tobacapital.com/,http://www.tobacapital.com/,,,"San Francisco, USA","San Francisco, USA","All VCs ,VC Founds - Seed - US/Europe",Jan-2012,"Early Stage Venture, Late Stage Venture, Seed",Venture Capital,28,122,Active
9f0a06de-7621-4f57-88b6-ce1b80db090e,Torch Capital,company,,"Consumer Goods, Financial Services, Food and Beverage, Hospitality, Wellness",,https://torchcapital.vc/,https://torchcapital.vc/,,,New York,New York,"All VCs ,VC Founds - Seed - US/Europe",Jan-2018,"Early Stage Venture, Seed",Venture Capital,3,71,Active
eab5e5b4-e51d-4f8d-8cf8-fca51d7e9df1,Touchdown Ventures,company,info@touchdownvc.com,Touchdown Ventures is a corporate venture capital firm that partners with corporations to invest in early and growth-stage companies.,info@touchdownvc.com,http://www.touchdownvc.com/,http://www.touchdownvc.com/,,,"Haddonfield, New Jersey, United States","Haddonfield, New Jersey, United States","Corporate Venture Arms,All VCs ,VC Founds - Seed - US/Europe",Jan-2014,"Early Stage Venture, Late Stage Venture, Seed",Corporate Venture Capital,15,71,Active
d2781137-be03-4da3-bd1d-a0e0d9adf426,Town Hall Ventures,company,,"Finance, Financial Services, Health Care, Venture Capital",,https://www.townhallventures.com/,https://www.townhallventures.com/,,,"330 Hudson St, New York, US","330 Hudson St, New York, US","All VCs ,VC Founds - Seed - US/Europe",May-2018,,Venture Capital,2,38,Active
e5f1a919-04c2-4cde-846a-9708a419d97a,TQ Ventures,company,,"Finance, Financial Services, Metaverse, Venture Capital",,tqventures.com,tqventures.com,,,"New York, New York, United States","New York, New York, United States","All VCs ,VC Founds - Seed - US/Europe",Jan-2018,"Early Stage Venture, Seed",Venture Capital,11,116,Active
08ef2b75-0e86-4926-a5e2-b77b5b52c1c3,Transformation Capital,company,,"Finance, Financial Services, Health Care, Venture Capital",,transformcap.com,transformcap.com,,,"Boston, Massachusetts, United States","Boston, Massachusetts, United States","All VCs ,VC Founds - Seed - US/Europe",Jan-2019,,Venture Capital,7,50,Active
440e3b93-18d9-48d7-bdaa-6324bb6aac2e,Transform Capital,company,,"Enterprise Software, Finance, Financial Exchanges, Financial Services, Venture Capital",,linkedin.com/company/transform-cap,linkedin.com/company/transform-cap,,,"San Mateo, California, United States","San Mateo, California, United States",VC Founds - Seed - US/Europe,Jan-2019,"Late Stage Venture, Venture","Private Equity Firm, Venture Capital",3,26,Active
d66e68f4-938c-41c8-a1f5-eed623fa87d8,Transform VC,company,,"Finance, Venture Capital",,linkedin.com/company/transform-vc/,linkedin.com/company/transform-vc/,,,"San Francisco, California, United States","San Francisco, California, United States",VC Founds - Seed - US/Europe,Jan-2000,"Early Stage Venture, Seed",Venture Capital,,15,Active
e1628faf-b02a-4247-b3f3-610debe2e77d,Translink Capital,company,,"Business Development, Financial Services, Venture Capital",,https://translinkcapital.com/,https://translinkcapital.com/,,,"530 Lytton Avenue, Suite 300 Palo Alto, CA 94301 United States","530 Lytton Avenue, Suite 300 Palo Alto, CA 94301 United States","All VCs ,VC Founds - Seed - US/Europe",Jan-2007,"Early Stage Venture, Late Stage Venture, Seed",Venture Capital,29,152,Active
95649f4b-186c-4b5c-9620-79b409f27b69,Tribe Capital,company,,Venture Capital,,http://www.tribecap.co/,http://www.tribecap.co/,,,"Louisville, USA","Louisville, USA","All VCs ,VC Founds - Seed - US/Europe",Jan-2018,"Early Stage Venture, Late Stage Venture, Venture",Venture Capital,6,214,Active
2ce14095-e3ef-4a1b-a896-3c64ad55ff6e,Trident Capital,company,,"Finance, Financial Services, Venture Capital",,http://www.tridentcap.com/,http://www.tridentcap.com/,,,"Palo Alto, California, United States","Palo Alto, California, United States",VC Founds - Seed - US/Europe,Jan-1993,"Debt, Early Stage Venture, Late Stage Venture",Venture Capital,78,218,Active
b43fc354-a12f-4144-983f-4a0b5246c680,Trinity Ventures,company,,"Finance, Venture Capital",,https://www.trinityventures.com/,https://www.trinityventures.com/,,,"Menlo Park, California, United States","Menlo Park, California, United States","All VCs ,VC Founds - Seed - US/Europe",Jan-1986,"Early Stage Venture, Late Stage Venture",Venture Capital,145,470,Active
1beaafa3-f166-430e-8ba6-0c98587b221e,TriplePoint Capital,company,,"Financial Services, Venture Capital",,https://www.triplepointcapital.com/,https://www.triplepointcapital.com/,,,"Menlo Park, California, United States","Menlo Park, California, United States",VC Founds - Seed - US/Europe,Jan-1987,"Debt, Early Stage Venture, Late Stage Venture, Seed",Venture Capital,57,163,Active
e7c2c139-c4e9-4a19-92a2-a9fdb7b290ac,Triventures,company,,"Cyber Security, FinTech, Health Care, Medical Device, mHealth, Venture Capital",,http://www.triventures.net,http://www.triventures.net,,,🇮🇱 Israel,🇮🇱 Israel,"All VCs ,VC Founds - Seed - US/Europe",Jan-2010,"Early Stage Venture, Seed, Venture",Venture Capital,8,49,Active
880312ea-ff80-4a83-bad2-eb77c3cf71d2,Tusk Venture Partners,company,,"Financial Services, Venture Capital",,tusk.vc,tusk.vc,,,"New York, New York, United States","New York, New York, United States","All VCs ,VC Founds - Seed - US/Europe",Jan-2016,"Early Stage Venture, Seed",Venture Capital,7,74,Active
94bb2505-07a2-4034-829e-e2516a04e0d1,Two Bear Capital,company,,,,twobearcapital.com,twobearcapital.com,,,"Whitefish, Montana, United States","Whitefish, Montana, United States","All VCs ,VC Founds - Seed - US/Europe",Jan-2019,Early Stage Venture,Venture Capital,,19,Active
6f95eb9b-a547-4d3c-966b-6cc65f8d5c81,Ulu Ventures,company,,"Financial Services, FinTech, Information Technology, Venture Capital",,https://www.uluventures.com/,https://www.uluventures.com/,,,"115 Everett Ave, Palo Alto, California 94301, US","115 Everett Ave, Palo Alto, California 94301, US","All VCs ,VC Founds - Seed - US/Europe",Jan-2008,"Early Stage Venture, Seed","Micro VC, Venture Capital",43,270,Active
f0d89ea5-a91c-444f-b7e0-652e88e4d0d0,Unanimous Capital,company,,"Business Development, Financial Services, Venture Capital",,unanimous.vc,unanimous.vc,,,"San Mateo, California, United States","San Mateo, California, United States","All VCs ,VC Founds - Seed - US/Europe",Jan-2018,Early Stage Venture,Venture Capital,3,37,Active
21f7de80-4743-4611-bac5-cd7c906cff28,Uncommon Denominator,company,,"Finance, Financial Services, Venture Capital",,uncommonvc.com,uncommonvc.com,,,"New York, New York, United States","New York, New York, United States","All VCs ,VC Founds - Seed - US/Europe",Jan-2018,Early Stage Venture,Venture Capital,6,28,Active
544f966e-7542-49f1-9d3c-b907c4265125,Union Square Ventures,company,,"Finance, Financial Services, Venture Capital",,http://www.usv.com/,http://www.usv.com/,,,"New York, New York, United States","New York, New York, United States",VC Founds - Seed - US/Europe,Jan-2003,"Debt, Early Stage Venture, Late Stage Venture, Seed",Venture Capital,58,446,Active
efb5f508-3f8c-45ce-b958-762b66d83344,Unlock Venture Partners,company,,"Financial Services, Information Technology, Venture Capital",,https://www.unlockvp.com/,https://www.unlockvp.com/,,,"Seattle, Washington, United States","Seattle, Washington, United States",VC Founds - Seed - US/Europe,Jan-2017,"Early Stage Venture, Seed",Venture Capital,6,76,Active
80175ddc-5303-41b6-8fee-382fc44a08e1,Unshackled Ventures,company,,"Finance, Financial Services, Venture Capital",,https://www.unshackledvc.com/,https://www.unshackledvc.com/,,,"435 Hamilton Ave, Palo Alto, CA 94301, US","435 Hamilton Ave, Palo Alto, CA 94301, US","All VCs ,VC Founds - Seed - US/Europe",Jan-2015,"Early Stage Venture, Seed","Micro VC, Venture Capital",4,78,Active
a16b82bd-d496-4122-81fd-4f590973c8a6,Upfront Ventures,company,,"Finance, Financial Services, FinTech, Venture Capital",,https://upfront.com/,https://upfront.com/,,,"Santa Monica, California, United States","Santa Monica, California, United States","All VCs ,VC Founds - Seed - US/Europe",Jan-1996,"Debt, Early Stage Venture, Late Stage Venture, Private Equity, Seed",Venture Capital,79,407,Active
e0108a64-2ea2-4adf-986c-73e1c0cb0569,UpHonest Capital,company,,"Business Development, Finance, Financial Services, Venture Capital",,https://www.uphonestcapital.com/,https://www.uphonestcapital.com/,,,"San Francisco, California, United States","San Francisco, California, United States","All VCs ,VC Founds - Seed - US/Europe",Jan-2015,"Early Stage Venture, Seed",Venture Capital,27,265,Active
6aa45402-d83f-4052-bc8c-91b0dc285f38,UpVentures Capital,company,,"CleanTech, Cyber Security, Enterprise Software, Financial Services, FinTech, Gaming, Internet of Things, Wearables",,linkedin.com/company/upventures-capital-llc,linkedin.com/company/upventures-capital-llc,,,"Little Falls, New York, United States","Little Falls, New York, United States","All VCs ,VC Founds - Seed - US/Europe",Jan-2014,"Early Stage Venture, Seed",Venture Capital,10,38,Active
f2c34e1b-a677-42f4-a2ce-40eda75dddd2,Valia Ventures,company,,,,https://www.valia.vc/,https://www.valia.vc/,,,"595 Pacific Avenue Jackson Square San Francisco, CA 94133","595 Pacific Avenue Jackson Square San Francisco, CA 94133","All VCs ,VC Founds - Seed - US/Europe",Oct-2017,"Early Stage Venture, Late Stage Venture",Venture Capital,4,46,Active
f61cb26a-9e6c-42f7-9e00-d9fdb4ab33da,Valor Capital Group,company,,Information Technology,,https://valorcapitalgroup.com/,https://valorcapitalgroup.com/,,,"New York, New York, United States","New York, New York, United States","All VCs ,VC Founds - Seed - US/Europe",Jan-2011,"Early Stage Venture, Late Stage Venture",Venture Capital,12,181,Active
a73f3dec-1aa9-40c3-8a95-a95da17a20b7,VamosVentures,company,,"FinTech, Health Care, Sustainability, Virtual Workforce",,vamosventures.com,vamosventures.com,,,"Los Angeles, California, United States","Los Angeles, California, United States","All VCs ,VC Founds - Seed - US/Europe",Jan-2020,Early Stage Venture,Venture Capital,,25,Active
83f9f40b-5a74-44a7-a621-179d13c270e7,Vast Ventures,company,,"Financial Services, FinTech, Service Industry, Venture Capital",,https://www.vastvc.com/,https://www.vastvc.com/,,,USA,USA,"All VCs ,VC Founds - Seed - US/Europe",Jan-2003,,Venture Capital,34,91,Active
2fe97859-8d75-4739-8ccf-e7d865c82451,VAS Ventures,company,,"Finance, Financial Services, FinTech, Venture Capital",,vas.ventures,vas.ventures,,,"Madrid, Madrid, Spain","Madrid, Madrid, Spain",VC Founds - Seed - US/Europe,Jan-2017,"Early Stage Venture, Seed",Venture Capital,3,17,Active
62ac522b-6757-42c9-ad37-943e46261766,Vela Partners,company,,"Artificial Intelligence (AI), B2B, Developer Tools, FinTech, Machine Learning, Venture Capital",,http://vela.partners/,http://vela.partners/,,,"San Francisco, California, United States","San Francisco, California, United States","All VCs ,VC Founds - Seed - US/Europe",Jan-2017,Early Stage Venture,Venture Capital,1,34,Active
8b2ab498-8461-41ea-ac76-6cd72488f3b2,Velvet Sea Ventures,company,,"Financial Services, Social Entrepreneurship, Venture Capital",,velvetseavc.com,velvetseavc.com,,,"New York, New York, United States","New York, New York, United States",VC Founds - Seed - US/Europe,Jan-2020,,Venture Capital,1,22,Active
573bc549-af08-4193-898a-15f28581cd37,Venrock,company,,"Finance, Financial Services, Venture Capital",,https://www.venrock.com/,https://www.venrock.com/,,,"Palo Alto, California, United States","Palo Alto, California, United States","All VCs ,VC Founds - Seed - US/Europe",Jan-1969,"Early Stage Venture, Late Stage Venture",Venture Capital,275,810,Active
